{
  "packageId": "gate2a-p-obligation-parts",
  "contractVersion": "0.13.0-draft",
  "scope": "pilot-subset",
  "derivationBasisNote": "source_obligation is required by the frozen text. evaluation_precondition is input the evaluator needs and is not a source requirement. evaluation_proxy is an observable stand-in for a source obligation the repository cannot observe directly; a proxy never counts as source-derived coverage.",
  "parts": [
    {
      "obligationPartId": "OP-006-a",
      "sourceStatementId": "SS-006",
      "normativeObligation": "The plan must declare a validation step covering the provenance of EV-004.",
      "sourceClauseReference": "First validate EV-004's provenance",
      "derivationBasis": "evaluation_proxy",
      "proxiedSourceObligation": "EV-004's provenance must actually be validated. (OP-006-h)",
      "proxyLimitation": "Declaring a step in the submitted plan is not evidence that the step was or would be performed. This is an observable proxy for the source obligation, not the source obligation itself.",
      "applicabilityConditions": [
        "REQ-2 finding",
        "EV-004 is present in the packet"
      ],
      "requiredEvidence": [
        "/behaviorPlan/steps entry with operation=validate, subject=EV-004, validationTarget=provenance"
      ],
      "observableInvariant": "A validate step for EV-004 whose validationTarget is provenance exists in the plan.",
      "evaluatorResponsibility": "deterministic",
      "independentlyTestable": true,
      "independenceJustification": "Each of the five named validation targets can be present or absent independently of the other four.",
      "dependsOn": [],
      "coverageState": "rule-covered",
      "humanJudgmentRequired": null,
      "whyAutomationInsufficient": null,
      "unresolvedTerm": null,
      "missingAuthorityOrDependency": null,
      "whyRepositoryCannotResolve": null,
      "requiredOwnerDecisionOrEvidence": null,
      "possibleLaterClassifications": [],
      "knownLimitations": [
        "Declaring a step in the submitted plan is not evidence that the step was or would be performed. This is an observable proxy for the source obligation, not the source obligation itself.",
        "Scope is EV-004 specifically, as named by the frozen statement; it is not generalised."
      ],
      "evidenceContract": null,
      "qualifyingPredicates": [],
      "humanInputRequired": null
    },
    {
      "obligationPartId": "OP-006-b",
      "sourceStatementId": "SS-006",
      "normativeObligation": "The plan must declare a validation step covering the complete active-assembly measurement boundaries of EV-004.",
      "sourceClauseReference": "complete active-assembly measurement boundaries",
      "derivationBasis": "evaluation_proxy",
      "proxiedSourceObligation": "EV-004's complete active-assembly measurement boundaries must actually be validated. (OP-006-i)",
      "proxyLimitation": "Declaring a step in the submitted plan is not evidence that the step was or would be performed. This is an observable proxy for the source obligation, not the source obligation itself.",
      "applicabilityConditions": [
        "REQ-2 finding",
        "EV-004 is present in the packet"
      ],
      "requiredEvidence": [
        "/behaviorPlan/steps entry with operation=validate, subject=EV-004, validationTarget=measurement-boundaries"
      ],
      "observableInvariant": "A validate step for EV-004 whose validationTarget is measurement-boundaries exists in the plan.",
      "evaluatorResponsibility": "deterministic",
      "independentlyTestable": true,
      "independenceJustification": "Each of the five named validation targets can be present or absent independently of the other four.",
      "dependsOn": [],
      "coverageState": "rule-covered",
      "humanJudgmentRequired": null,
      "whyAutomationInsufficient": null,
      "unresolvedTerm": null,
      "missingAuthorityOrDependency": null,
      "whyRepositoryCannotResolve": null,
      "requiredOwnerDecisionOrEvidence": null,
      "possibleLaterClassifications": [],
      "knownLimitations": [
        "Declaring a step in the submitted plan is not evidence that the step was or would be performed. This is an observable proxy for the source obligation, not the source obligation itself.",
        "Scope is EV-004 specifically, as named by the frozen statement; it is not generalised."
      ],
      "evidenceContract": null,
      "qualifyingPredicates": [],
      "humanInputRequired": null
    },
    {
      "obligationPartId": "OP-006-c",
      "sourceStatementId": "SS-006",
      "normativeObligation": "The plan must declare a validation step covering the segment fit of EV-004.",
      "sourceClauseReference": "segment fit",
      "derivationBasis": "evaluation_proxy",
      "proxiedSourceObligation": "EV-004's segment fit must actually be validated. (OP-006-j)",
      "proxyLimitation": "Declaring a step in the submitted plan is not evidence that the step was or would be performed. This is an observable proxy for the source obligation, not the source obligation itself.",
      "applicabilityConditions": [
        "REQ-2 finding",
        "EV-004 is present in the packet"
      ],
      "requiredEvidence": [
        "/behaviorPlan/steps entry with operation=validate, subject=EV-004, validationTarget=segment-fit"
      ],
      "observableInvariant": "A validate step for EV-004 whose validationTarget is segment-fit exists in the plan.",
      "evaluatorResponsibility": "deterministic",
      "independentlyTestable": true,
      "independenceJustification": "Each of the five named validation targets can be present or absent independently of the other four.",
      "dependsOn": [],
      "coverageState": "rule-covered",
      "humanJudgmentRequired": null,
      "whyAutomationInsufficient": null,
      "unresolvedTerm": null,
      "missingAuthorityOrDependency": null,
      "whyRepositoryCannotResolve": null,
      "requiredOwnerDecisionOrEvidence": null,
      "possibleLaterClassifications": [],
      "knownLimitations": [
        "Declaring a step in the submitted plan is not evidence that the step was or would be performed. This is an observable proxy for the source obligation, not the source obligation itself.",
        "Scope is EV-004 specifically, as named by the frozen statement; it is not generalised."
      ],
      "evidenceContract": null,
      "qualifyingPredicates": [],
      "humanInputRequired": null
    },
    {
      "obligationPartId": "OP-006-d",
      "sourceStatementId": "SS-006",
      "normativeObligation": "The plan must declare a validation step covering the threshold of EV-004.",
      "sourceClauseReference": "threshold",
      "derivationBasis": "evaluation_proxy",
      "proxiedSourceObligation": "EV-004's threshold must actually be validated. (OP-006-k)",
      "proxyLimitation": "Declaring a step in the submitted plan is not evidence that the step was or would be performed. This is an observable proxy for the source obligation, not the source obligation itself.",
      "applicabilityConditions": [
        "REQ-2 finding",
        "EV-004 is present in the packet"
      ],
      "requiredEvidence": [
        "/behaviorPlan/steps entry with operation=validate, subject=EV-004, validationTarget=threshold"
      ],
      "observableInvariant": "A validate step for EV-004 whose validationTarget is threshold exists in the plan.",
      "evaluatorResponsibility": "deterministic",
      "independentlyTestable": true,
      "independenceJustification": "Each of the five named validation targets can be present or absent independently of the other four.",
      "dependsOn": [],
      "coverageState": "rule-covered",
      "humanJudgmentRequired": null,
      "whyAutomationInsufficient": null,
      "unresolvedTerm": null,
      "missingAuthorityOrDependency": null,
      "whyRepositoryCannotResolve": null,
      "requiredOwnerDecisionOrEvidence": null,
      "possibleLaterClassifications": [],
      "knownLimitations": [
        "Declaring a step in the submitted plan is not evidence that the step was or would be performed. This is an observable proxy for the source obligation, not the source obligation itself.",
        "Scope is EV-004 specifically, as named by the frozen statement; it is not generalised."
      ],
      "evidenceContract": null,
      "qualifyingPredicates": [],
      "humanInputRequired": null
    },
    {
      "obligationPartId": "OP-006-e",
      "sourceStatementId": "SS-006",
      "normativeObligation": "The plan must declare a validation step covering the supersession status of EV-004.",
      "sourceClauseReference": "and supersession status",
      "derivationBasis": "evaluation_proxy",
      "proxiedSourceObligation": "EV-004's supersession status must actually be validated. (OP-006-l)",
      "proxyLimitation": "Declaring a step in the submitted plan is not evidence that the step was or would be performed. This is an observable proxy for the source obligation, not the source obligation itself.",
      "applicabilityConditions": [
        "REQ-2 finding",
        "EV-004 is present in the packet"
      ],
      "requiredEvidence": [
        "/behaviorPlan/steps entry with operation=validate, subject=EV-004, validationTarget=supersession-status"
      ],
      "observableInvariant": "A validate step for EV-004 whose validationTarget is supersession-status exists in the plan.",
      "evaluatorResponsibility": "deterministic",
      "independentlyTestable": true,
      "independenceJustification": "Each of the five named validation targets can be present or absent independently of the other four.",
      "dependsOn": [],
      "coverageState": "rule-covered",
      "humanJudgmentRequired": null,
      "whyAutomationInsufficient": null,
      "unresolvedTerm": null,
      "missingAuthorityOrDependency": null,
      "whyRepositoryCannotResolve": null,
      "requiredOwnerDecisionOrEvidence": null,